[
  {
    "id": "verbexp-p01",
    "title": "Distansarbetets effekt",
    "type": "word_problem",
    "topic": "Argumentationsanalys",
    "difficulty": 3,
    "contextText": "Sedan företaget införde fullt distansarbete i januari har den totala försäljningen stigit med 14 procent. HR-chefen drar slutsatsen att distansarbetet är orsaken till försäljningslyftet och föreslår att modellen permanentas. Hon påpekar att uppgången sammanföll i tid med övergången och att medarbetarna uppger sig vara nöjdare. Under samma period lanserade dock säljavdelningen en ny produktlinje och en stor konkurrent lämnade marknaden. HR-chefen nämner inte dessa faktorer i sin rapport till ledningen.",
    "questions": [
      {
        "id": "verbexp-p01-q01",
        "passageId": "verbexp-p01",
        "questionNumber": 1,
        "questionText": "Vilket logiskt felslut begår HR-chefens argument?",
        "difficulty": 3,
        "options": [
          {
            "id": "a",
            "text": "Korrelation tolkas som orsak",
            "isCorrect": true
          },
          {
            "id": "b",
            "text": "Halmgubbe (förvränger motståndarens position)",
            "isCorrect": false
          },
          {
            "id": "c",
            "text": "Auktoritetsargument (vädjar till auktoritet utan stöd)",
            "isCorrect": false
          },
          {
            "id": "d",
            "text": "Cirkelresonemang (petitio principii)",
            "isCorrect": false
          }
        ],
        "correctAnswerId": "a",
        "explanation": "Att försäljningen steg samtidigt som distansarbetet infördes visar bara ett samband i tid, inte att det ena orsakade det andra; flera andra faktorer (ny produktlinje, bortfallen konkurrent) kan förklara lyftet. Det är inte en halmgubbe, eftersom ingen motståndarposition förvrängs."
      },
      {
        "id": "verbexp-p01-q02",
        "passageId": "verbexp-p01",
        "questionNumber": 2,
        "questionText": "Vilket antagande MÅSTE vara sant för att HR-chefens slutsats ska hålla?",
        "difficulty": 3,
        "options": [
          {
            "id": "a",
            "text": "Att inga andra betydande faktorer bidrog till försäljningsökningen under perioden",
            "isCorrect": true
          },
          {
            "id": "b",
            "text": "Att alla medarbetare föredrar distansarbete framför kontorsarbete",
            "isCorrect": false
          },
          {
            "id": "c",
            "text": "Att försäljningen kommer att fortsätta stiga nästa kvartal",
            "isCorrect": false
          },
          {
            "id": "d",
            "text": "Att konkurrenten lämnade marknaden på grund av distansarbetet",
            "isCorrect": false
          }
        ],
        "correctAnswerId": "a",
        "explanation": "För att distansarbetet ensamt ska kunna tillskrivas lyftet krävs att konkurrerande förklaringar är uteslutna. Att medarbetarna föredrar distans är irrelevant för orsakssambandet med försäljningen."
      },
      {
        "id": "verbexp-p01-q03",
        "passageId": "verbexp-p01",
        "questionNumber": 3,
        "questionText": "Vad skulle mest FÖRSVAGA HR-chefens argument?",
        "difficulty": 3,
        "options": [
          {
            "id": "a",
            "text": "Att en intern analys visar att hela försäljningsökningen kan hänföras till den nya produktlinjen",
            "isCorrect": true
          },
          {
            "id": "b",
            "text": "Att medarbetarna rapporterar något kortare lunchpauser hemma",
            "isCorrect": false
          },
          {
            "id": "c",
            "text": "Att konkurrenten var verksam i ett angränsande land",
            "isCorrect": false
          },
          {
            "id": "d",
            "text": "Att distansarbete är vanligt i branschen",
            "isCorrect": false
          }
        ],
        "correctAnswerId": "a",
        "explanation": "Om hela ökningen kan förklaras av produktlinjen försvinner grunden för att tillskriva distansarbetet effekten. De övriga alternativen påverkar inte orsaksanspråket nämnvärt."
      },
      {
        "id": "verbexp-p01-q04",
        "passageId": "verbexp-p01",
        "questionNumber": 4,
        "questionText": "Vilken slutsats följer logiskt av de presenterade premisserna?",
        "difficulty": 3,
        "options": [
          {
            "id": "a",
            "text": "Försäljningen steg under samma period som distansarbetet infördes",
            "isCorrect": true
          },
          {
            "id": "b",
            "text": "Distansarbetet orsakade försäljningsökningen",
            "isCorrect": false
          },
          {
            "id": "c",
            "text": "Den nya produktlinjen hade ingen effekt på försäljningen",
            "isCorrect": false
          },
          {
            "id": "d",
            "text": "Medarbetarnas nöjdhet ökade försäljningen",
            "isCorrect": false
          }
        ],
        "correctAnswerId": "a",
        "explanation": "Premisserna fastställer enbart ett samtidigt förlopp, vilket alternativ a uttrycker korrekt. Orsakspåståendena i b och d går utöver vad premisserna stöder."
      }
    ]
  },
  {
    "id": "verbexp-p02",
    "title": "Budgetnedskärningen",
    "type": "word_problem",
    "topic": "Argumentationsanalys",
    "difficulty": 3,
    "contextText": "På styrelsemötet argumenterar finansdirektören mot förslaget att skära ned marknadsföringsbudgeten med tio procent. Han säger att den som vill minska marknadsföringen tydligen anser att företaget helt ska sluta synas och låta varumärket dö ut. Att överge kunderna på det sättet vore förödande och oansvarigt, fortsätter han. Förslagsställaren hade dock endast föreslagit en måttlig justering av en post, inte att marknadsföringen skulle avvecklas. Styrelsen applåderar finansdirektörens engagemang och avslår nedskärningen.",
    "questions": [
      {
        "id": "verbexp-p02-q01",
        "passageId": "verbexp-p02",
        "questionNumber": 1,
        "questionText": "Vilket logiskt felslut begår finansdirektören?",
        "difficulty": 3,
        "options": [
          {
            "id": "a",
            "text": "Halmgubbe (förvränger motståndarens position)",
            "isCorrect": true
          },
          {
            "id": "b",
            "text": "Falskt dilemma (bara två alternativ när fler finns)",
            "isCorrect": false
          },
          {
            "id": "c",
            "text": "Ad hominem (angriper personen)",
            "isCorrect": false
          },
          {
            "id": "d",
            "text": "Lutande planet (slippery slope)",
            "isCorrect": false
          }
        ],
        "correctAnswerId": "a",
        "explanation": "Finansdirektören ersätter förslaget om en tioprocentig justering med en överdriven version (att helt sluta synas) och bemöter sedan den. Det är inte ett falskt dilemma, eftersom han inte påstår att det bara finns två alternativ utan vränger om vad motparten faktiskt sa."
      },
      {
        "id": "verbexp-p02-q02",
        "passageId": "verbexp-p02",
        "questionNumber": 2,
        "questionText": "Vad är det centrala problemet med hur finansdirektören bemöter förslaget?",
        "difficulty": 3,
        "options": [
          {
            "id": "a",
            "text": "Han bemöter en position som förslagsställaren aldrig framförde",
            "isCorrect": true
          },
          {
            "id": "b",
            "text": "Han hänvisar till en auktoritet utan att ange källa",
            "isCorrect": false
          },
          {
            "id": "c",
            "text": "Han bygger sitt argument på ett enstaka exempel",
            "isCorrect": false
          },
          {
            "id": "d",
            "text": "Han antar att slutsatsen redan är sann i sin premiss",
            "isCorrect": false
          }
        ],
        "correctAnswerId": "a",
        "explanation": "Felet ligger i att den bemötta ståndpunkten (avveckla marknadsföringen) inte är den föreslagna (justera med tio procent). Inget i resonemanget rör auktoriteter eller enstaka exempel."
      },
      {
        "id": "verbexp-p02-q03",
        "passageId": "verbexp-p02",
        "questionNumber": 3,
        "questionText": "Vad skulle bäst AVSLÖJA svagheten i finansdirektörens argument?",
        "difficulty": 3,
        "options": [
          {
            "id": "a",
            "text": "Att man jämför hans beskrivning med förslagets faktiska ordalydelse",
            "isCorrect": true
          },
          {
            "id": "b",
            "text": "Att man undersöker finansdirektörens personliga ekonomiska intressen",
            "isCorrect": false
          },
          {
            "id": "c",
            "text": "Att man frågar om branschexperter delar hans uppfattning",
            "isCorrect": false
          },
          {
            "id": "d",
            "text": "Att man räknar hur många kunder företaget skulle förlora",
            "isCorrect": false
          }
        ],
        "correctAnswerId": "a",
        "explanation": "Eftersom felet är att förslaget förvrängts, blottläggs det genom att ställa hans beskrivning mot den verkliga formuleringen. Att granska hans intressen vore i stället att riskera ett ad hominem."
      },
      {
        "id": "verbexp-p02-q04",
        "passageId": "verbexp-p02",
        "questionNumber": 4,
        "questionText": "Vilken slutsats följer INTE logiskt av premisserna?",
        "difficulty": 3,
        "options": [
          {
            "id": "a",
            "text": "Att en tioprocentig nedskärning skulle leda till att varumärket dör ut",
            "isCorrect": true
          },
          {
            "id": "b",
            "text": "Att förslaget gällde en måttlig justering av en budgetpost",